{
  "$schema": "https://json-schema.org/draft/2020-12/schema",
  "$id": "https://oyzu.dev/contracts/kinds-v1alpha1/manifest.schema.json",
  "title": "Draft deployment kind protocol v1alpha1: kind manifest",
  "description": "What a kind declares it can do. The platform checks a release plan against these declarations before the release is created.",
  "type": "object",
  "additionalProperties": false,
  "required": ["schema_version", "type", "name", "version", "operations", "target_settings_schema", "connectors"],
  "properties": {
    "schema_version": { "const": "v1alpha1" },
    "type": { "const": "deployment-kind-manifest" },
    "name": { "$ref": "common.schema.json#/$defs/name" },
    "version": { "$ref": "common.schema.json#/$defs/semver" },
    "description": { "type": "string", "minLength": 1, "maxLength": 1000 },
    "role": {
      "description": "deployment (the default): the kind deploys components to targets. verification: the kind runs verifications (a test suite, an external tool) and never changes a target.",
      "enum": ["deployment", "verification"]
    },
    "operations": {
      "description": "Every operation the kind implements, with its timeout. A deployment kind requires validate, plan, apply and observe; a verification kind requires validate and verify and has no others. A watch's timeout is how long one watch runs before the pool starts the next.",
      "type": "object",
      "additionalProperties": false,
      "properties": {
        "validate": { "$ref": "#/$defs/operation" },
        "plan": { "$ref": "#/$defs/operation" },
        "apply": { "$ref": "#/$defs/operation" },
        "observe": { "$ref": "#/$defs/operation" },
        "watch": { "$ref": "#/$defs/operation" },
        "stage": { "$ref": "#/$defs/operation" },
        "shift": { "$ref": "#/$defs/operation" },
        "switch": { "$ref": "#/$defs/operation" },
        "retire": { "$ref": "#/$defs/operation" },
        "abort": { "$ref": "#/$defs/operation" },
        "rollback": { "$ref": "#/$defs/operation" },
        "drift": { "$ref": "#/$defs/operation" },
        "verify": { "$ref": "#/$defs/operation" }
      }
    },
    "rollback": {
      "description": "native: the kind implements the rollback operation. redeploy: the engine plans and applies the previous observed version. none: there is no rollback.",
      "enum": ["native", "redeploy", "none"]
    },
    "strategies": {
      "type": "array",
      "minItems": 1,
      "maxItems": 16,
      "items": {
        "type": "object",
        "additionalProperties": false,
        "required": ["name", "mode"],
        "properties": {
          "name": { "$ref": "#/$defs/strategy" },
          "mode": {
            "description": "native: the engine drives each step through this kind's operations. delegated: a tool the customer already runs times the steps, and the kind starts, observes, promotes and aborts it.",
            "enum": ["native", "delegated"]
          },
          "tool": {
            "description": "The tool a delegated strategy hands timing to, for example Argo Rollouts.",
            "type": "string",
            "minLength": 1,
            "maxLength": 128
          },
          "stages_first_deployment": {
            "description": "Whether the kind can stage a version where nothing is live yet. Absent or false, a target's first deployment under this strategy is a plain apply and the strategy's steps start with the next release. Meaningful only for blue-green, canary, linear and shadow.",
            "type": "boolean"
          }
        },
        "if": { "properties": { "mode": { "const": "delegated" } } },
        "then": { "required": ["tool"] },
        "else": { "not": { "required": ["tool"] } }
      }
    },
    "default_strategy": {
      "description": "The kind's own update, used when no rollout policy names a strategy. Must be one of strategies.",
      "$ref": "#/$defs/strategy"
    },
    "target_settings_schema": {
      "description": "A JSON Schema (2020-12) object for this kind's target settings.",
      "type": "object"
    },
    "connectors": {
      "description": "Connector types whose credentials the pool may release to this kind. Apply and observe credentials are separate; observe is read-only. named lists the connector types a target may bind beside them under an alias of its choosing, one per alias (a Terraform module's long-tail providers, the metrics sources a check reads); absent or empty means the kind takes no named connectors.",
      "type": "object",
      "additionalProperties": false,
      "required": ["apply", "observe"],
      "properties": {
        "apply": { "$ref": "#/$defs/connectorTypes" },
        "observe": { "$ref": "#/$defs/connectorTypes" },
        "named": { "$ref": "#/$defs/connectorTypes" }
      }
    },
    "observation": {
      "description": "How often the pool observes a target of this kind, and when an observation is too old to trust (IMPL-279, IMPL-281). A kind that declares watch streams observations instead of being polled, and is polled at the active interval only while no watch runs. Absent members take the platform's defaults: every 15 seconds while an execution is in flight, every 300 at rest, drift every 3600 when the kind has drift, and stale after 1200.",
      "type": "object",
      "additionalProperties": false,
      "properties": {
        "interval_seconds": {
          "type": "object",
          "additionalProperties": false,
          "properties": {
            "active": { "description": "While an execution is in flight on the target.", "type": "integer", "minimum": 5, "maximum": 3600 },
            "rest": { "description": "At rest.", "type": "integer", "minimum": 30, "maximum": 86400 }
          }
        },
        "drift_interval_seconds": { "type": "integer", "minimum": 300, "maximum": 604800 },
        "stale_after_seconds": {
          "description": "A target not observed for this long becomes Needs attention, and no gate passes on its observation. It must be longer than the rest interval.",
          "type": "integer",
          "minimum": 60,
          "maximum": 604800
        }
      }
    }
  },
  "allOf": [
    {
      "if": { "properties": { "role": { "const": "verification" } }, "required": ["role"] },
      "then": {
        "properties": {
          "operations": {
            "required": ["validate", "verify"],
            "propertyNames": { "enum": ["validate", "verify", "abort"] }
          },
          "strategies": false,
          "default_strategy": false,
          "rollback": false
        }
      },
      "else": {
        "required": ["rollback", "strategies", "default_strategy"],
        "properties": {
          "operations": {
            "required": ["validate", "plan", "apply", "observe"],
            "not": { "required": ["verify"] }
          }
        }
      }
    },
    {
      "if": { "properties": { "rollback": { "const": "native" } }, "required": ["rollback"] },
      "then": { "properties": { "operations": { "required": ["rollback"] } } },
      "else": { "properties": { "operations": { "not": { "required": ["rollback"] } } } }
    },
    {
      "if": { "required": ["observation"], "properties": { "observation": { "required": ["drift_interval_seconds"] } } },
      "then": { "properties": { "operations": { "required": ["drift"] } } }
    }
  ],
  "$defs": {
    "operation": {
      "type": "object",
      "additionalProperties": false,
      "required": ["timeout_seconds"],
      "properties": {
        "timeout_seconds": { "type": "integer", "minimum": 1, "maximum": 86400 }
      }
    },
    "strategy": { "enum": ["recreate", "rolling", "blue-green", "canary", "linear", "shadow"] },
    "connectorTypes": {
      "type": "array",
      "maxItems": 32,
      "uniqueItems": true,
      "items": { "$ref": "common.schema.json#/$defs/name" }
    }
  }
}
